{
  "durable_host_store_format": "determa.durable_host.store",
  "durable_host_store_schema_version": 2,
  "checkpoint": {
    "event_identity_tombstones": [],
    "execution_checkpoint_digest": "sha256:62f63d2b9315b3704f9f32b9ac2efa85dafef3bf7efd06d42c1b5e6a99554731",
    "execution_checkpoint_format": "determa.execution_checkpoint",
    "execution_checkpoint_schema_version": 2,
    "migration_audit_records": [
      {
        "migration_audit_record_schema_version": 2,
        "migration_descriptor_digest": "sha256:48e62dc1d066711cc07265cc948939da3fa1b26895654727b1183536343b6fb0",
        "migration_sequence": "1",
        "result_code": "migration_applied",
        "root_instance_id": "maintenance-v2-root",
        "root_runtime_id": "sha256:6c915160117efed1e414319ba9a4a2577caa8cb25a2b250b38779d190a97c8d8",
        "source_aggregate_state_digest": "sha256:0f86fe31a45ce75b4c592dbc1ecbe24054654e7a86446dcd896734730cf810f5",
        "source_validated_bundle_fingerprint": "sha256:e7f3e557bb92158f4f7dbf45d5190b6e9c9b25813a70018962af498e98466df0",
        "target_aggregate_state_digest": "sha256:26fba30febee786ba96164e515e27cf1e06ee4e66f98960418da89f7c1eda01a",
        "target_validated_bundle_fingerprint": "sha256:41b244b4d1f8f12e7d096fcc8c3f607d1ccfa07364560dccd20b416decfecd18"
      }
    ],
    "next_operation_receipt_sequence": "2",
    "next_outbox_terminal_sequence": "0",
    "operation_receipts": [
      {
        "committed_revision": "0",
        "creation_id": "maintenance-v2-create",
        "emission_references": [],
        "fault": null,
        "operation_kind": "creation",
        "receipt_sequence": "0",
        "request_digest": "sha256:d28c7750d383b25721975736c02a8763356f9ba5ca114164e2893661c1250621",
        "resulting_aggregate_state_digest": "sha256:0f86fe31a45ce75b4c592dbc1ecbe24054654e7a86446dcd896734730cf810f5",
        "status": "running"
      },
      {
        "committed_revision": "1",
        "migration_sequences": [
          "1"
        ],
        "operation_id": "maintenance-v2-one-hop",
        "operation_kind": "maintenance_migration",
        "receipt_sequence": "1",
        "request_digest": "sha256:2cbc3325672bd9053d37f5a8364e7bf4adf38bee5dbc046fe8f6ff90436de1e0",
        "result_code": "migration_applied",
        "resulting_aggregate_state_digest": "sha256:26fba30febee786ba96164e515e27cf1e06ee4e66f98960418da89f7c1eda01a",
        "source_aggregate_state_digest": "sha256:0f86fe31a45ce75b4c592dbc1ecbe24054654e7a86446dcd896734730cf810f5",
        "target_validated_bundle_fingerprint": "sha256:41b244b4d1f8f12e7d096fcc8c3f607d1ccfa07364560dccd20b416decfecd18"
      }
    ],
    "outbox_effect_tombstones": [],
    "pending_outbox_intents": [],
    "replay_retention": {
      "mode": "permanent",
      "permanent_replay_eligible": true,
      "policy_identifier": null,
      "pruned_through_receipt_sequence": null
    },
    "revision": "1",
    "root_instance_id": "maintenance-v2-root",
    "root_record": {
      "aggregate_state": {
        "aggregate_state_digest": "sha256:26fba30febee786ba96164e515e27cf1e06ee4e66f98960418da89f7c1eda01a",
        "aggregate_state_format": "determa.aggregate_state",
        "aggregate_state_schema_version": 2,
        "creation_id": "maintenance-v2-create",
        "machine_format": 1,
        "migration_sequence": "1",
        "namespace": "example.transaction_server",
        "next_acceptance_sequence": "0",
        "next_logical_step_sequence": "1",
        "next_output_sequence": "0",
        "next_queue_sequence": "0",
        "root_instance_id": "maintenance-v2-root",
        "root_machine_id": "transaction_server",
        "root_machine_version": "1",
        "root_runtime_id": "sha256:6c915160117efed1e414319ba9a4a2577caa8cb25a2b250b38779d190a97c8d8",
        "runtimes": [
          {
            "active_leaf_state_definition_pointers": [
              "/machines/0/root/states/idle"
            ],
            "active_state_activations": [
              {
                "activation_sequence": "0",
                "state_definition_pointer": "/machines/0/root"
              },
              {
                "activation_sequence": "0",
                "state_definition_pointer": "/machines/0/root/states/idle"
              }
            ],
            "current_definition": {
              "machine": {
                "machine_id": "transaction_server",
                "machine_version": "1",
                "namespace": "example.transaction_server",
                "root_definition_pointer": "/machines/0/root"
              },
              "validated_bundle_fingerprint": "sha256:41b244b4d1f8f12e7d096fcc8c3f607d1ccfa07364560dccd20b416decfecd18"
            },
            "deferred_mailbox": [],
            "fault": null,
            "history": [],
            "identity_origin": {
              "definition": {
                "machine": {
                  "machine_id": "transaction_server",
                  "machine_version": "1",
                  "namespace": "example.transaction_server",
                  "root_definition_pointer": "/machines/0/root"
                },
                "validated_bundle_fingerprint": "sha256:e7f3e557bb92158f4f7dbf45d5190b6e9c9b25813a70018962af498e98466df0"
              },
              "kind": "root",
              "root_instance_id": "maintenance-v2-root"
            },
            "next_component_activation_sequences": [],
            "next_spawn_sequence": "0",
            "next_state_activation_sequences": [
              {
                "definition_pointer": "/machines/0/root",
                "next_sequence": "1"
              },
              {
                "definition_pointer": "/machines/0/root/states/idle",
                "next_sequence": "1"
              }
            ],
            "ready_mailbox": [],
            "relation": {
              "kind": "root"
            },
            "runtime_id": "sha256:6c915160117efed1e414319ba9a4a2577caa8cb25a2b250b38779d190a97c8d8",
            "status": "running",
            "target_identity": {
              "root": {
                "root_instance_id": "maintenance-v2-root",
                "root_runtime_id": "sha256:6c915160117efed1e414319ba9a4a2577caa8cb25a2b250b38779d190a97c8d8"
              }
            },
            "variables": []
          }
        ],
        "validated_bundle_fingerprint": "sha256:41b244b4d1f8f12e7d096fcc8c3f607d1ccfa07364560dccd20b416decfecd18"
      },
      "status": "retained"
    },
    "terminal_outbox_records": []
  },
  "inbox": [
    {
      "event_id": "persistence-2-event",
      "request_digest": "sha256:cdcb4ce5f6076de19b165ec76c8007ca6c7de6c92813c86dba02d2a4218bf5bc",
      "disposition": "quarantined"
    }
  ],
  "application_rows": {},
  "quarantine": {
    "event_id": "persistence-2-event",
    "reason_code": "permanent_processing_failure",
    "released": false
  },
  "broker_acknowledged": false
}
